"Embracing Self-Powered Wireless Wearables for Smart Healthcare","L. Yuan; C. Xiong; S. Chen; W. Gong",University of Science and Technology of China; University of Science and Technology of China; Simon Fraser University; University of Science and Technology of China,2021 IEEE International Conference on Pervasive Computing and Communications (PerCom),"25 May 2021","2021","","","1","7","We present Apollo, a self-powered wireless biochemical system that is wearable and can continuously monitor personal health states. It has three key enablers. First, we design an ultra-low-power Bluetooth backscatter module, which can effectively take BLE signals as excitations and transmit sensor data at high data rates to smartphones. Further, at the core of self-power management is a novel multi-source harvester that can transform RF, light, and thermal energies into electrical energy. Moreover, we introduce a biochemical sensor array that can accurately measure sweat metabolites and electrolytes.We prototype Apollo on a compactly integrated flexible PCB using all commercial off-the-shelf components. Through extensive experiments and field studies, we show that it is able to measure the glucose level in sweat within 5% error rate while consuming 5.8 mW for sensing and 720 pJ/bit for wireless transmissions. This translates to over 1700x lower power than standard electrochemical workstations, and 26x lower power than existing commercial BLE chipsets. We believe Apollo marks an important step towards the dream of ubiquitous healthcare for everyone as it provides a highly convenient, self-managed, and fully integrated way for health monitoring.","2474-249X","978-1-6654-0418-1","10.1109/PERCOM50583.2021.9439117","","https://ieeexplore.ieee.org/stamp/stamp.jsp?arnumber=9439117","biosensors;sweat;backscatter;energy harvesting","Wireless communication;Wireless sensor networks;Wearable computers;Medical services;Workstations;Biosensors;Biomedical monitoring","","11","","31","IEEE","25 May 2021","","","IEEE","IEEE Conferences"
"Lan: Learning to Augment Noise Tolerance for Self-report Survey Labels","S. Lin; L. Faust; N. V. Chawla","University of Notre Dame, Indiana, USA; University of Notre Dame, Indiana, USA; University of Notre Dame, Indiana, USA",2021 IEEE International Conference on Pervasive Computing and Communications (PerCom),"25 May 2021","2021","","","1","10","The prevalence of mobile sensors makes it possible for researchers to collect and analyze the pervasive sensed human activity data with machine learning tools. These analyses and applications heavily rely on the self-report survey data that reflect human physical and psychological behaviors. However, many factors can affect the reliability of such self-report surveys, such as participants' trusty and ambiguous descriptions in questionnaires. These inaccurate survey labels challenge the development of the models, especially when it comes to the case where deep learning approaches tend to memorize the noisy information from training data. In this paper, we set out to deal with the noisy self-report survey labels. We aim to address the following challenges: 1)the limited access to clean labeled data in real-world scenarios; 2)different noise ratio of the data from different participants; 3)various types of noise that appear in the data; 4)how to evaluate the reliability of participants. As such, we propose a generalizable model, Lan, for learning from multi-modal sensory data and noisy labels. The proposed model incorporates the temporal information from sensory data to guide the model training and thus to augment noise tolerance. Extensive experiments on a real-world dataset were conducted to show our model outperforms state-of-the-art benchmarks.","2474-249X","978-1-6654-0418-1","10.1109/PERCOM50583.2021.9439109","Office of the Director; Intelligence Advanced Research Projects Activity; ","https://ieeexplore.ieee.org/stamp/stamp.jsp?arnumber=9439109","noise tolerance;self-report surveys;multi-modal sensory data","Training;Pervasive computing;Computational modeling;Training data;Psychology;Tools;Data models","","1","","43","IEEE","25 May 2021","","","IEEE","IEEE Conferences"
"SolAR: Energy Positive Human Activity Recognition using Solar Cells","M. M. Sandhu; S. Khalifa; K. Geissdoerfer; R. Jurdak; M. Portmann","School of Information Technology and Electrical Engineering, The University of Queensland, Brisbane, Australia; Data61, Commonwealth Scientific and Industrial Research Organization (CSIRO), Australia; Networked Embedded Systems Lab, TU, Dresden, Germany; Data61, Commonwealth Scientific and Industrial Research Organization (CSIRO), Australia; School of Information Technology and Electrical Engineering, The University of Queensland, Brisbane, Australia",2021 IEEE International Conference on Pervasive Computing and Communications (PerCom),"25 May 2021","2021","","","1","10","The high power consumption of inertial activity sensors limits the battery lifetime of today’s wearable devices. Recent studies promise to extend the lifetime of wearable devices by translating kinetic energy from human movements into electrical energy while using the harvesting signal to replace conventional activity sensors. However, in human-centric applications, the amount of harvested kinetic energy is not enough to power a real-time activity recognition algorithm and run the wearable device perpetually. In this paper, we propose Solar based human Activity Recognition (SolAR), which uses solar cells simultaneously as an activity sensor as well as an energy source. Our key observation is that the power available from a wrist-worn solar cell changes dynamically while a person moves, encoding information about the underlying activity. We collect empirical solar energy data to explore its activity sensing potential and implement the activity recognition pipeline on an ultra low-power micro-controller unit to evaluate the end-to-end power consumption of the system. Our analysis reveals that SolAR improves activity recognition accuracy by up to 8.3% and harvests more than one order of magnitude higher power compared to its kinetic counterpart. This enables SolAR to generate more energy than required for the entire activity recognition pipeline, which we term as energy positive activity recognition, achieving uninterrupted, autonomous, self-powered and real-time operation.","2474-249X","978-1-6654-0418-1","10.1109/PERCOM50583.2021.9439128","","https://ieeexplore.ieee.org/stamp/stamp.jsp?arnumber=9439128","Wearables;Solar;Kinetic;Energy Harvesting;Sensors;Human Activity Recognition;Energy Positive Sensing","Power demand;Wearable computers;Photovoltaic cells;Heuristic algorithms;Pipelines;Solar energy;Activity recognition","","19","","40","IEEE","25 May 2021","","","IEEE","IEEE Conferences"
"GAZEL: Runtime Gaze Tracking for Smartphones","J. Park; S. Park; H. Cha","Department of Computer Science, Yonsei University, Seoul, Republic of Korea; Department of Computer Science, Yonsei University, Seoul, Republic of Korea; Department of Computer Science, Yonsei University, Seoul, Republic of Korea",2021 IEEE International Conference on Pervasive Computing and Communications (PerCom),"25 May 2021","2021","","","1","10","Although work has been conducted on smartphone gaze tracking, the existing techniques are not pervasively used because of their heavy weight and low accuracy. Our preliminary analysis shows that these techniques would work better if their models were trained with data from tablets which have large screens. In this paper, we propose GAZEL, a runtime smartphone gaze-tracking scheme that achieves high accuracy on real devices. The key idea of GAZEL, a tablet-to-smartphone transfer learning, is to train a CNN model with data collected from tablets and then transplant the model to a smartphone. To achieve the goal, we designed a new CNN-based model architecture that is head pose resilient and light enough to operate at runtime. We also exploit implicit calibration to alleviate errors caused by differences in users' visual and device characteristics. The experiment results with commercial smartphones show that GAZEL achieves 27.5% better accuracy on smartphones compared to the state-of-the-art techniques and provides gaze tracking at up to 18 fps which is practically usable at runtime.","2474-249X","978-1-6654-0418-1","10.1109/PERCOM50583.2021.9439113","National Research Foundation; ","https://ieeexplore.ieee.org/stamp/stamp.jsp?arnumber=9439113","runtime;gaze tracking;mobile;smartphone;transfer learning;head pose","Pervasive computing;Visualization;Runtime;Transfer learning;Gaze tracking;Computer architecture;Data models","","7","","38","IEEE","25 May 2021","","","IEEE","IEEE Conferences"
"Consent-driven data use in crowdsensing platforms: When data reuse meets privacy-preservation","M. Brahem; G. Scerri; N. Anciaux; V. Issarny","Petrus team, Inria, France; Petrus team, Inria, France; Petrus team, Inria, France; Mimove team, Inria, France",2021 IEEE International Conference on Pervasive Computing and Communications (PerCom),"25 May 2021","2021","","","1","10","Crowdsensing is an essential element of the IoT; it allows gathering massive data across time and space to feed our environmental knowledge, and to link such knowledge to user behavior. However, there are major obstacles to crowdsensing, including the preservation of privacy. The consideration of privacy in crowdsensing systems has led to two main approaches, sometimes combined, which are, respectively, to trade privacy for rewards, and to take advantage of privacy-enhancing technologies ""anonymizing"" the collected data. Although relevant, we claim that these approaches do not sufficiently take into account the users’ own tolerance to the use of the data provided, so that the crowdsensing system guarantees users the expected level of confidentiality as well as fosters the use of crowdsensing data for different tasks. To this end, we introduce the ℓ-completeness property, which ensures that the data provided can be used for all the tasks to which their owners consent as long as they are analyzed with ℓ − 1 other sources, and that no privacy violations can occur due to the related contribution of users with less stringent privacy requirements. The challenge, therefore, is to ensure ℓ-completeness when analyzing the data while allowing the data to be used for as many tasks as possible and promoting the accuracy of the resulting knowledge. We address this challenge with a clustering algorithm sensitive to the data distribution, which is shown to optimize data reuse and utility using a dataset from a deployed crowdsensing application.","2474-249X","978-1-6654-0418-1","10.1109/PERCOM50583.2021.9439125","","https://ieeexplore.ieee.org/stamp/stamp.jsp?arnumber=9439125","Crowdsensing;Privacy;Consent","Pervasive computing;Data privacy;Privacy;Crowdsensing;Conferences;Data models;Resource management","","2","","51","IEEE","25 May 2021","","","IEEE","IEEE Conferences"
"Voltaire: Precise Energy-Aware Code Offloading Decisions with Machine Learning","M. Breitbach; J. Edinger; S. Kaupmees; H. Trötsch; C. Krupitzer; C. Becker","University of Mannheim, Germany; University of Hamburg, Germany; University of Cambridge, United Kingdom; University of Mannheim, Germany; University of Hohenheim, Germany; University of Mannheim, Germany",2021 IEEE International Conference on Pervasive Computing and Communications (PerCom),"25 May 2021","2021","","","1","10","Code offloading enables resource-constrained devices to leverage idle computing power of remote resources. In addition to performance gains, offloading helps to reduce energy consumption of mobile devices, which is a key challenge in pervasive computing research and industry. In today's distributed computing systems, the decision whether to execute a task locally or remotely for minimal energy usage is non-trivial. Uncertainty about the task complexity and the result data size require a careful offloading decision. In this paper, we present Voltaire— a novel scheduler for sophisticated energy-aware code offloading decisions. Voltaire applies machine learning methods on crowd-sourced data about past executions to accurately predict the complexity and the result data size of an upcoming task. Combining these predictions with device-specific energy profiles and context knowledge allows Voltaire to estimate the energy consumption on the mobile device. Thus, Voltaire makes well-informed offloading decisions and carefully selects local or remote execution based on the expected energy consumption. We integrate Voltaire into the Tasklet distributed computing system and perform extensive experiments in a real-world testbed. Our results with three real-world applications show that Voltaire reduces the energy usage of task executions by 12.5% compared to a baseline scheduler.","2474-249X","978-1-6654-0418-1","10.1109/PERCOM50583.2021.9439121","","https://ieeexplore.ieee.org/stamp/stamp.jsp?arnumber=9439121","energy-aware code offloading;mobile ad-hoc computing;machine learning;Tasklet system","Pervasive computing;Energy consumption;Uncertainty;Runtime;Machine learning;Mobile handsets;Complexity theory","","5","","45","IEEE","25 May 2021","","","IEEE","IEEE Conferences"
"Data Collection Utility Maximization in Wireless Sensor Networks via Efficient Determination of UAV Hovering Locations","M. Chen; W. Liang; S. K. Das","ACT, The Australian National University, Canberra, Australia; ACT, The Australian National University, Canberra, Australia; ACT, The Australian National University, Canberra, Australia",2021 IEEE International Conference on Pervasive Computing and Communications (PerCom),"25 May 2021","2021","","","1","10","Data collection in Wireless Sensor Networks (WSNs) has been a hot research topic owing to the accelerated development in the Internet of Things (IoT). With high agility, mobility and flexibility, the Unmanned Aerial Vehicle (UAV) is widely considered as a promising technology for data collection in WSNs. Under the one-to-many data collection scheme, where a UAV is able to collect data from multiple sensors simultaneously within its reception range, the identification of hovering locations of the UAV impacts the efficiency of data collection significantly. Most existing studies either neglect this critical issue or discretize the UAV serving area into small regions with a given size, which results in the inevitable utility loss of data collection. In this paper, we jointly consider the hovering location positioning of the UAV and the utility maximization of data collection. Specifically, we first formulate a novel data collection utility maximization problem (UMP) and show that it is an NP-hard problem. We then devise an efficient algorithm for precisely positioning (potential) UAV hovering locations, which improves the data collection utility significantly. We also propose an approximation algorithm for UMP with approximation ratio $\left( {1 - \frac{1}{e}} \right)$, where e is the base of the natural logarithm. We finally evaluate the performance of the proposed algorithms through simulation experiments, and demonstrate that the proposed algorithms significantly outperform four heuristics.","2474-249X","978-1-6654-0418-1","10.1109/PERCOM50583.2021.9439126","Australian Research Council; ","https://ieeexplore.ieee.org/stamp/stamp.jsp?arnumber=9439126","Unmanned aerial vehicles (UAV);wireless sensor networks (WSNs);Internet of Things (IoT);data collection;approximation algorithms;utility maximization;energy efficiency","Pervasive computing;Wireless sensor networks;NP-hard problem;Heuristic algorithms;Simulation;Data collection;Approximation algorithms","","17","","28","IEEE","25 May 2021","","","IEEE","IEEE Conferences"
"A Federated Learning Aggregation Algorithm for Pervasive Computing: Evaluation and Comparison","S. EK; F. PORTET; P. LALANDA; G. VEGA","CNRS, Grenoble INP LIG, Univ. Grenoble Alpes, Grenoble, France; CNRS, Grenoble INP LIG, Univ. Grenoble Alpes, Grenoble, France; CNRS, Grenoble INP LIG, Univ. Grenoble Alpes, Grenoble, France; CNRS, Grenoble INP LIG, Univ. Grenoble Alpes, Grenoble, France",2021 IEEE International Conference on Pervasive Computing and Communications (PerCom),"25 May 2021","2021","","","1","10","Pervasive computing promotes the installation of connected devices in our living spaces in order to provide services. Two major developments have gained significant momentum recently: an advanced use of edge resources and the integration of machine learning techniques for engineering applications. This evolution raises major challenges, in particular related to the appropriate distribution of computing elements along an edge-to-cloud continuum. About this, Federated Learning has been recently proposed for distributed model training in the edge. The principle of this approach is to aggregate models learned on distributed clients in order to obtain a new, more general model. The resulting model is then redistributed to clients for further training. To date, the most popular federated learning algorithm uses coordinate-wise averaging of the model parameters for aggregation. However, it has been shown that this method is not adapted in heterogeneous environments where data is not identically and independently distributed (non-iid). This corresponds directly to some pervasive computing scenarios where heterogeneity of devices and users challenges machine learning with the double objective of generalization and personalization. In this paper, we propose a novel aggregation algorithm, termed FedDist, which is able to modify its model architecture (here, deep neural network) by identifying dissimilarities between specific neurons amongst the clients. This permits to account for clients' specificity without impairing generalization. Furthermore, we define a complete method to evaluate federated learning in a realistic way taking generalization and personalization into account. Using this method, FedDist is extensively tested and compared with three state-of-the-art federated learning algorithms on the pervasive domain of Human Activity Recognition with smartphones.","2474-249X","978-1-6654-0418-1","10.1109/PERCOM50583.2021.9439129","","https://ieeexplore.ieee.org/stamp/stamp.jsp?arnumber=9439129","Federated Learning;algorithm;evaluation;Human Activity Recognition","Pervasive computing;Training;Adaptation models;Machine learning algorithms;Computational modeling;Neurons;Machine learning","","45","","40","IEEE","25 May 2021","","","IEEE","IEEE Conferences"
"Characterizing Everyday Objects using Human Touch: Thermal Dissipation as a Sensing Modality","H. Emenike; F. Dar; M. Liyanage; R. Sharma; A. Zuniga; M. A. Hoque; M. Radeta; P. Nurmi; H. Flores","Institute of Computer Science, University of Tartu, Tartu, Estonia; Institute of Computer Science, University of Tartu, Tartu, Estonia; Institute of Computer Science, University of Tartu, Tartu, Estonia; Institute of Computer Science, University of Tartu, Tartu, Estonia; Department of Computer Science, University of Helsinki, Helsinki, Finland; Department of Computer Science, University of Helsinki, Helsinki, Finland; Wave Lab, ITI/LARSyS, University of Madeira, Funchal, Portugal; Department of Computer Science, University of Helsinki, Helsinki, Finland; Institute of Computer Science, University of Tartu, Tartu, Estonia",2021 IEEE International Conference on Pervasive Computing and Communications (PerCom),"25 May 2021","2021","","","1","8","We contribute MIDAS as a novel sensing solution for characterizing everyday objects using thermal dissipation. MIDAS takes advantage of the fact that anytime a person touches an object, it results in heat transfer. By capturing and modeling the dissipation of the transferred heat, e.g., through the decrease in the captured thermal radiation, MIDAS can characterize the object and determine its material. We validate MIDAS through extensive empirical benchmarks and demonstrate that MIDAS offers an innovative sensing modality that can recognize a wide range of materials – with up to 83% accuracy – and generalize to variations in the people interacting with objects.","2474-249X","978-1-6654-0418-1","10.1109/PERCOM50583.2021.9439120","","https://ieeexplore.ieee.org/stamp/stamp.jsp?arnumber=9439120","thermal imaging;mobile computing;pervasive computing;IoT;material sensing","Pervasive computing;Conferences;Benchmark testing;Sensors;Heat transfer","","8","","35","IEEE","25 May 2021","","","IEEE","IEEE Conferences"
"Opportunistic Federated Learning: An Exploration of Egocentric Collaboration for Pervasive Computing Applications","S. Lee; X. Zheng; J. Hua; H. Vikalo; C. Julien","Department of Electrical and Computer Engineering, University of Texas, Austin; Department of Computing, Macquarie University; Department of Electrical and Computer Engineering, University of Texas, Austin; Department of Electrical and Computer Engineering, University of Texas, Austin; Department of Electrical and Computer Engineering, University of Texas, Austin",2021 IEEE International Conference on Pervasive Computing and Communications (PerCom),"25 May 2021","2021","","","1","8","Pervasive computing applications commonly involve user's personal smartphones collecting data to influence application behavior. Applications are often backed by models that learn from the user's experiences to provide personalized and responsive behavior. While models are often pre-trained on massive datasets, federated learning has gained attention for its ability to train globally shared models on users' private data without requiring the users to share their data directly. However, federated learning requires devices to collaborate via a central server, under the assumption that all users desire to learn the same model. We define a new approach, opportunistic federated learning, in which individual devices belonging to different users seek to learn robust models that are personalized to their user's own experiences. However, instead of learning in isolation, these models opportunistically incorporate the learned experiences of other devices they encounter opportunistically. In this paper, we explore the feasibility and limits of such an approach, culminating in a framework that supports encounter-based pairwise collaborative learning. The use of our opportunistic encounter-based learning amplifies the performance of personalized learning while resisting overfitting to encountered data.","2474-249X","978-1-6654-0418-1","10.1109/PERCOM50583.2021.9439130","","https://ieeexplore.ieee.org/stamp/stamp.jsp?arnumber=9439130","pervasive computing;federated learning;collaborative deep learning;distributed machine learning","Pervasive computing;Performance evaluation;Computational modeling;Conferences;Collaboration;Machine learning;Collaborative work","","27","","39","IEEE","25 May 2021","","","IEEE","IEEE Conferences"
"MousePath: Enhancing PC Web Pages through Smartphone and Optical Mouse","Z. Wang; Q. Huang; Y. Yan; H. Ren; Y. Zhang; Z. Yang","School of Information Science and Technology, ShanghaiTech University; Southern University of Science and Technology, Peng Cheng Laboratory; School of Information Science and Technology, ShanghaiTech University; School of Information Science and Technology, ShanghaiTech University; School of Information Science and Technology, ShanghaiTech University; School of Information Science and Technology, ShanghaiTech University",2021 IEEE International Conference on Pervasive Computing and Communications (PerCom),"25 May 2021","2021","","","1","7","This paper proposes MousePath, a novel lightweight communication system between PC web pages and smartphones. MousePath works by putting the optical mouse on top of the smartphone's screen, then its transmission starts and is instantly finished without association and pairing friction. It encodes data into the movement of smartphone's display content and leverages the optical mouse of the computer to sense the movement for decoding the data. We prototype and evaluate the system with commercial computers and smartphones. A key benefit of MousePath is that it can be seamlessly integrated into web pages. Two representative web applications, i.e., sensor sharing and message sharing, have been developed to demonstrate MousePath's potential in enhancing PC web page functionalities.","2474-249X","978-1-6654-0418-1","10.1109/PERCOM50583.2021.9439139","Research and Development; Shanghai Education Development Foundation; ","https://ieeexplore.ieee.org/stamp/stamp.jsp?arnumber=9439139","Cross Device Information Sharing;Optical Mouse;Visible Light Communication","Pervasive computing;Friction;Web pages;Prototypes;Optical receivers;Mice;Information management","","3","","22","IEEE","25 May 2021","","","IEEE","IEEE Conferences"
