"Document Title",Authors,"Author Affiliations","Publication Title",Date Added To Xplore,"Publication Year","Volume","Issue","Start Page","End Page","Abstract","ISSN",ISBNs,"DOI",Funding Information,PDF Link,"Author Keywords","IEEE Terms","Mesh_Terms",Article Citation Count,Patent Citation Count,"Reference Count","License",Online Date,Issue Date,"Meeting Date","Publisher",Document Identifier
"[Copyright notice]","",,2021 IEEE International Conference on Pervasive Computing and Communications (PerCom),"25 May 2021","2021","","","i","i","Presents the copyright information for the conference. May include reprint permission information.","2474-249X","978-1-6654-0418-1","10.1109/PERCOM50583.2021.9439131","","https://ieeexplore.ieee.org/stamp/stamp.jsp?arnumber=9439131","","","","","","","IEEE","25 May 2021","","","IEEE","IEEE Conferences"
"Welcome from the General Chairs","",,2021 IEEE International Conference on Pervasive Computing and Communications (PerCom),"25 May 2021","2021","","","i","i","Presents the introductory welcome message from the conference proceedings. May include the conference officers' congratulations to all involved with the conference event and publication of the proceedings record.","2474-249X","978-1-6654-0418-1","10.1109/PERCOM50583.2021.9439132","","https://ieeexplore.ieee.org/stamp/stamp.jsp?arnumber=9439132","","","","","","","IEEE","25 May 2021","","","IEEE","IEEE Conferences"
"TPC Welcome","",,2021 IEEE International Conference on Pervasive Computing and Communications (PerCom),"25 May 2021","2021","","","i","i","Presents the introductory welcome message from the conference proceedings. May include the conference officers' congratulations to all involved with the conference event and publication of the proceedings record.","2474-249X","978-1-6654-0418-1","10.1109/PERCOM50583.2021.9439135","","https://ieeexplore.ieee.org/stamp/stamp.jsp?arnumber=9439135","","","","","","","IEEE","25 May 2021","","","IEEE","IEEE Conferences"
"Committees","",,2021 IEEE International Conference on Pervasive Computing and Communications (PerCom),"25 May 2021","2021","","","i","vi","Provides a listing of current committee members and society officers.","2474-249X","978-1-6654-0418-1","10.1109/PERCOM50583.2021.9439114","","https://ieeexplore.ieee.org/stamp/stamp.jsp?arnumber=9439114","","","","","","","IEEE","25 May 2021","","","IEEE","IEEE Conferences"
"Keynotes","",,2021 IEEE International Conference on Pervasive Computing and Communications (PerCom),"25 May 2021","2021","","","i","ii","Provides an abstract for each of the keynote presentations and may include a brief professional biography of each presenter. The complete presentations were not made available for publication as part of the conference proceedings.","2474-249X","978-1-6654-0418-1","10.1109/PERCOM50583.2021.9439136","","https://ieeexplore.ieee.org/stamp/stamp.jsp?arnumber=9439136","","","","","","","IEEE","25 May 2021","","","IEEE","IEEE Conferences"
"Panel","",,2021 IEEE International Conference on Pervasive Computing and Communications (PerCom),"25 May 2021","2021","","","i","i","Summary form only given. An infrastructure is called critical (CRITIS) if its disruption poses a severe threat to public life. During the recent pandemics, videoconferencing, home office/schooling, and global virus data dashboards made the public aware of how dependent we have become on ""the Internet"", or rather on ICT (information and communication technology): ICT has truly become a CRITIS. The most frightening aspect in this trend is the fact that ICT is known, from both everyday experience and serious studies, to be fragile i.e. vulnerable and for the most part rather unreliable. This is why the ICT that functions as the 'nervous system' of the power grid, and of any other CRITIS, must be resilient. A particular subject of CRITIS resilience are multi-sector urban CRITIS: the growth and mechanization of cities led to a complex interwoven network of traffic, power, heating, municipal supply and disposal, etc., both indispensable for citizens and fragile. Recently, R&D efforts around Smart Cities showed that the increasing urban challenges, from pollution to traffic gridlock, from rural-urban migration to gentrification, call for ICT as a key factor in the complicated city equation. However, increasing natural catastrophes, human errors, technical threads (e.g., from nearby chemical or nuclear plants) and attacks / cyberattacks are heavily threatening the critical urban infrastructures. In summary, all of the above leads to the key panel questions: How to morph ICT from the problem into the solution for resilience-both for common CRITIS like the power grid and for smart cities i.e. urban infrastructures? This question can be divided into two parts. How to reach resilience FOR ICT i.e. how can ICT be made resilient? How to reach resilience THROUGH ICT i.e. how can ICT help to make other infrastructures more resilient rather than more fragile? The panel will initially address these questions from a more general perspective, before diving into issues related to the role of PerCom technologies such as: The role of PerCom technologies - for increased fragility or greater resilience Key PerCom design principles and concepts that may yield resilience.","2474-249X","978-1-6654-0418-1","10.1109/PERCOM50583.2021.9439138","","https://ieeexplore.ieee.org/stamp/stamp.jsp?arnumber=9439138","","Resilience;Pervasive computing;Information and communication technology;Conferences;Smart cities;Privacy;Nervous system","","","","","IEEE","25 May 2021","","","IEEE","IEEE Conferences"
"Technical Program","",,2021 IEEE International Conference on Pervasive Computing and Communications (PerCom),"25 May 2021","2021","","","i","iii","Provides a schedule of conference events and a listing of which papers were presented in each session.","2474-249X","978-1-6654-0418-1","10.1109/PERCOM50583.2021.9439115","","https://ieeexplore.ieee.org/stamp/stamp.jsp?arnumber=9439115","","","","","","","IEEE","25 May 2021","","","IEEE","IEEE Conferences"
"About IEEE PerCom 2021","",,2021 IEEE International Conference on Pervasive Computing and Communications (PerCom),"25 May 2021","2021","","","i","i","Presents the introductory welcome message from the conference proceedings. May include the conference officers' congratulations to all involved with the conference event and publication of the proceedings record.","2474-249X","978-1-6654-0418-1","10.1109/PERCOM50583.2021.9439119","","https://ieeexplore.ieee.org/stamp/stamp.jsp?arnumber=9439119","","","","","","","IEEE","25 May 2021","","","IEEE","IEEE Conferences"
"Mobility Improves Accuracy: Precise Robot Manipulation with COTS RFID Systems","H. Wang; S. Chen; W. Gong",University of Science and Technology of China; Simon Fraser University; University of Science and Technology of China,2021 IEEE International Conference on Pervasive Computing and Communications (PerCom),"25 May 2021","2021","","","1","10","This paper presents GLAC, the first 3D localization system that enables millimeter-level object manipulation for robotics using only COTS RFID devices. The key insight of GLAC is that mobility reduces ambiguity and thus improves accuracy. Unlike state-of-the-art systems that require extra time or hardware to boost performance, it draws the power of modeling mobility in a delicate way. In particular, we build a novel framework for real-time tracking using the Hidden Markov Model (HMM). In our framework, multiple Kalman filters are designed to take a single phase observation for updating mobility states, and a fast inference algorithm is proposed to efficiently process an exponentially large number of candidate trajectories. We prototype GLAC with only UHF tags and a commercial reader of four antennas. Comprehensive experiments show that the median position accuracies of x/y/z dimensions are within 1 cm for both LoS and NLoS cases. The median position accuracy for slow-moving targets is 0.41 cm, which is 2.2×, 17.3×, and 14.9× better than TurboTrack, Tagoram, and RF-IDraw, respectively. Also, its median velocity accuracy is at least 20 better than all three competitors for fast-moving targets. Besides accuracy, it achieves more than 4× localization time gains over state-of-the-art systems.","2474-249X","978-1-6654-0418-1","10.1109/PERCOM50583.2021.9439133","","https://ieeexplore.ieee.org/stamp/stamp.jsp?arnumber=9439133","RFID;Real-time Tracking;High speed","Location awareness;Three-dimensional displays;Welding;Hidden Markov models;Surgery;UHF antennas;Real-time systems","","5","","57","IEEE","25 May 2021","","","IEEE","IEEE Conferences"
"HandRate: Heart Rate Monitoring While Simply Holding a Smartphone","K. Jiokeng; G. Jakllari; A. -L. Beylot","IRIT/Toulouse INP-ENSEEIHT, University of Toulouse, France; IRIT/Toulouse INP-ENSEEIHT, University of Toulouse, France; IRIT/Toulouse INP-ENSEEIHT, University of Toulouse, France",2021 IEEE International Conference on Pervasive Computing and Communications (PerCom),"25 May 2021","2021","","","1","11","We present HandRate, the first smartphone-based system using a standard sensor (accelerometer) for opportunistically computing heart rate while a user holds their phone. Fundamentally, HandRate revisits ballistocardiography (BCG), a century-old technique for monitoring heart activity by measuring the body movement caused by the cardiac cycle. Traditionally performed using custom hardware, attached to a subject's body, revisiting BCG for the smartphone, held in hand, faces several challenges. The hand is an external organ furthest from the aorta and subject to motion artifacts, leading to a weak and noisy signal, while the position the phone is held in can impact which accelerometer axis best captures BCG. HandRate addresses these challenges by introducing a design involving two modules operating in tandem: the first aimed at transforming the accelerometer readings into a single-dimensional signal oblivious to how the phone is held, while the second module making heartbeat predictions based on this signal. Results from testing HandRate using data collected from 18 subjects show that it can estimate heart rate with accuracy similar to or better than systems requiring special sensors and/or active user participation.","2474-249X","978-1-6654-0418-1","10.1109/PERCOM50583.2021.9439134","Agence Nationale de la Recherche; ","https://ieeexplore.ieee.org/stamp/stamp.jsp?arnumber=9439134","Heart Activity Monitoring;Hand-based Ballis-tocardiography;Mobile Sensing;Heartbeats detection","Accelerometers;Pervasive computing;Heart beat;Sensors;Noise measurement;Motion measurement;Monitoring","","4","","57","IEEE","25 May 2021","","","IEEE","IEEE Conferences"
"iEdge: An IoT-assisted Edge Computing Framework","H. Lee; S. Lee; Y. C. Lee; H. Han; S. Kang","Dept. of Computer Science, Hanyang University, Korea; Dept. of Computer Science, Hanyang University, Korea; Dept. of Computing, Macquarie University, Australia; Dept. of Computer Science, Dongduk Women’s University, Korea; Dept. of Computer Science, Hanyang University, Korea",2021 IEEE International Conference on Pervasive Computing and Communications (PerCom),"25 May 2021","2021","","","1","8","Edge computing has emerged as a viable solution to bridge the gap between distributed Internet of Things (IoT) devices and centralized distant clouds. In particular, small-scale servers are deployed at the edge of network (i.e., edge servers) to `help' cloud servers process data IoT devices constantly generate. However, these edge servers often struggle to deal with emerging applications that require real-time data processing in situ, such as real-time facial recognition. In this paper, we present iEdge as an IoT-assisted edge computing framework that enables the seamless execution of applications across an edge server and nearby IoT devices. The seamless execution in essence has been realized by transforming platform-dependent monolithic applications to cross-platform composite applications and offloading some tasks/functions of these composite applications to IoT devices considering device context. We have evaluated iEdge using a prototype implementation with a real-time facial recognition application. Experimental results show that iEdge effectively harnesses smart IoT devices as a consolidated edge computing execution environment and enables such an application to process more video streams than typical `edge-only' computing.","2474-249X","978-1-6654-0418-1","10.1109/PERCOM50583.2021.9439122","","https://ieeexplore.ieee.org/stamp/stamp.jsp?arnumber=9439122","Edge computing;Internet of Things;Fog computing;IoT-assisted edge computing;In-site data analytics","Pervasive computing;Cloud computing;Face recognition;Prototypes;Streaming media;Real-time systems;Servers","","6","","25","IEEE","25 May 2021","","","IEEE","IEEE Conferences"
"The Feasibility of Dense Indoor LoRaWAN Towards Passively Sensing Human Presence","J. Grübel; T. Thrash; D. Hélal; R. W. Sumner; C. Hölscher; V. R. Schinazi","ETH Zürich, Zürich, Switzerland; Miami University, Oxford, OH, USA; Orbiwise, Geneva, Switzerland; ETH Zürich, Zürich, Switzerland; ETH Zürich, Zürich, Switzerland; Bond University, Robina, Australia",2021 IEEE International Conference on Pervasive Computing and Communications (PerCom),"25 May 2021","2021","","","1","11","Long Range Wide Area Network (LoRaWAN) has been advanced as an alternative for creating indoor sensor networks that extends beyond its original long-distance communication purpose. For the present paper, we developed a Dense Indoor Sensor Network (DISN) with 390 sensor nodes and three gateways and empirically evaluated its performance for half a year. Our analysis of more than 14 million transmissions revealed that DISNs achieve a much lower distance coverage compared to previous research. In addition, the deployment of multiple gateways decreased the loss of transmissions due to environmental and network factors such as concurrently received messages. Given the complexity of our system, we received few colliding concurrent messages, which demonstrates a gap between the projected requirements of LoRaWAN systems and the actual requirements of real-world applications. Our attenuation model indicates that robust coverage in an indoor environment can be maintained by placing a gateway every 30 m and every 5 floors. We discuss the application of DISNs for the passive sensing and visualization of human presence using a Digital Twin (DT).","2474-249X","978-1-6654-0418-1","10.1109/PERCOM50583.2021.9439137","","https://ieeexplore.ieee.org/stamp/stamp.jsp?arnumber=9439137","","Wide area networks;Upper bound;Computational modeling;Wires;Logic gates;Predictive models;Sensors","","3","","51","IEEE","25 May 2021","","","IEEE","IEEE Conferences"
"FADACS: A Few-Shot Adversarial Domain Adaptation Architecture for Context-Aware Parking Availability Sensing","W. Shao; S. Zhao; Z. Zhang; S. Wang; M. S. Rahaman; A. Song; F. D. Salim","School of Computing Technologies, RMIT University, Melbourne, VIC, Australia; School of Computing Technologies, RMIT University, Melbourne, VIC, Australia; School of Computing Technologies, RMIT University, Melbourne, VIC, Australia; School of Computing Technologies, RMIT University, Melbourne, VIC, Australia; School of Computing Technologies, RMIT University, Melbourne, VIC, Australia; School of Computing Technologies, RMIT University, Melbourne, VIC, Australia; School of Computing Technologies, RMIT University, Melbourne, VIC, Australia",2021 IEEE International Conference on Pervasive Computing and Communications (PerCom),"25 May 2021","2021","","","1","10","Existing research on parking availability sensing mainly relies on extensive contextual and historical information. In practice, the availability of such information is a challenge as it requires continuous collection of sensory signals. In this study, we design an end-to-end transfer learning framework for parking availability sensing to predict parking occupancy in areas in which the parking data is insufficient to feed into data-hungry models. This framework overcomes two main challenges: 1) many real-world cases cannot provide enough data for most existing data-driven models, and 2) it is difficult to merge sensor data and heterogeneous contextual information due to the differing urban fabric and spatial characteristics. Our work adopts a widely-used concept, adversarial domain adaptation, to predict the parking occupancy in an area without abundant sensor data by leveraging data from other areas with similar features. In this paper, we utilise more than 35 million parking data records from sensors placed in two different cities, one a city centre and the other a coastal tourist town. We also utilise heterogeneous spatio-temporal contextual information from external resources, including weather and points of interest. We quantify the strength of our proposed framework in different cases and compare it to the existing data-driven approaches. The results show that the proposed framework is comparable to existing state-of-the-art methods and also provide some valuable insights on parking availability prediction.","2474-249X","978-1-6654-0418-1","10.1109/PERCOM50583.2021.9439123","","https://ieeexplore.ieee.org/stamp/stamp.jsp?arnumber=9439123","transfer learning;parking availability;sensor network;transportation","Pervasive computing;Adaptation models;Urban areas;Transfer learning;Sea measurements;Predictive models;Data models","","17","","36","IEEE","25 May 2021","","","IEEE","IEEE Conferences"
"Enabling In-Ear Magnetic Sensing: Automatic and User Transparent Magnetometer Calibration","A. Ferlini; A. Montanari; A. Grammenos; R. Harle; C. Mascolo","University of Cambridge, UK; Nokia Bell Labs, Cambridge, UK; University of Cambridge, UK; University of Cambridge, UK; University of Cambridge, UK",2021 IEEE International Conference on Pervasive Computing and Communications (PerCom),"25 May 2021","2021","","","1","8","Earables (in-ear wearables) are a new frontier in wearables. Acting both as leisure devices, providing personal audio, as well as sensing platforms, earables could collect sensor data for the upper part of the body, subject to fewer vibrations and random movement variations than the lower parts of the body, due to inherent damping in the musculoskeletal system. These data may enable application domains such as augmented/virtual reality, medical rehabilitation, and health condition screening. Unfortunately, earables have inherent size, shape, and weight constraints limiting the type and position of the sensors on such platforms. For instance, lacking a magnetometer in all earables reference platforms, earables lack reference points. Thus, it becomes harder to work with absolute orientations. Embedding magnetometers in earables is challenging, as these rely heavily on radio (mostly Bluetooth) communication (RF) and contain magnets for magnetic-driven speakers and docking. We explore the feasibility of adding a built-in magnetometer in an earbud, presenting the first comprehensive study of the magnetic interference impacting the magnetometer when placed in an earable: both that caused by the speaker and by RF (music streaming and voice calls) are considered. We find that appropriate calibration of the magnetometer removes the offsets induced by the magnets, the speaker, and the variable interference due to BT. Further, we present an automatic, user-transparent adaptive calibration that obviates the need for alternative, expensive, and error-prone manual, or robotics, calibration procedures. Our evaluation shows how our calibration approach performs under different conditions, achieving convincing results with errors below 3° for the majority of the experiments.","2474-249X","978-1-6654-0418-1","10.1109/PERCOM50583.2021.9439112","","https://ieeexplore.ieee.org/stamp/stamp.jsp?arnumber=9439112","","Radio frequency;Vibrations;Magnetometers;Magnetomechanical effects;Wearable computers;Magnetic domains;Interference","","1","","42","IEEE","25 May 2021","","","IEEE","IEEE Conferences"
"Deep Triplet Networks with Attention for Sensor-based Human Activity Recognition","B. Khaertdinov; E. Ghaleb; S. Asteriadis","Maastricht University, Maastricht, the Netherlands; Maastricht University, Maastricht, the Netherlands; Maastricht University, Maastricht, the Netherlands",2021 IEEE International Conference on Pervasive Computing and Communications (PerCom),"25 May 2021","2021","","","1","10","One of the most significant challenges in Human Activity Recognition using wearable devices is inter-class similarities and subject heterogeneity. These problems lead to the difficulties in constructing robust feature representations that might negatively affect the quality of recognition. This study, for the first time, applies deep triplet networks with various triplet loss functions and mining methods to the Human Activity Recognition task. Moreover, we introduce a novel method for constructing hard triplets by exploiting similarities between subjects performing the same activities using the concept of Hierarchical Triplet Loss. Our deep triplet models are based on the recent state-of-the-art LSTM networks with two attention mechanisms. The extensive experiments conducted in this paper identify important hyperparameters and settings for training deep metric learning models on widely-used open-source Human Activity Recognition datasets. The comparison of the proposed models against the recent benchmark models shows that deep metric learning approach has the potential to improve the quality of recognition. Specifically, at least one of the implemented triplet networks shows the state-of-the-art results for each dataset used in this study, namely PAMAP2, USC-HAD and MHEALTH. Another positive effect of applying deep triplet networks and especially the proposed sampling algorithm is that feature representations are less affected by inter-class similarities and subject heterogeneity issues.","2474-249X","978-1-6654-0418-1","10.1109/PERCOM50583.2021.9439116","","https://ieeexplore.ieee.org/stamp/stamp.jsp?arnumber=9439116","","Measurement;Training;Adaptation models;Wearable computers;Conferences;Activity recognition;Benchmark testing","","32","","34","IEEE","25 May 2021","","","IEEE","IEEE Conferences"
"Density-Based Data Selection and Management for Edge Computing","H. Oikawa; M. Kondo","Graduate School of Information Science and Technology, The University of Tokyo, Tokyo, Japan; Graduate School of Information Science and Technology, The University of Tokyo, Tokyo, Japan",2021 IEEE International Conference on Pervasive Computing and Communications (PerCom),"25 May 2021","2021","","","1","11","Wide spread of IoT devices has made it possible to acquire enormous amounts of realtime sensor information. Due to the explosive increase in the sensing data volume, it becomes difficult to collect and process all the data in one central place. On one hand, storing and processing data on edge devices, so called edge computing, is becoming important. On the other hand, edge devices usually have only limited computing and memory resources, and hence it is not practical to process and save all the acquired data. There is a great demand of effectively selecting data to process on an edge device or to transfer it to a cloud server. In this paper, we propose an efficient density-based data selection and management method called O-D2M by which edge devices store the data representing inherent data distribution. We use a low cost graph algorithm to analyze input data trend and its density. We evaluate effectiveness of the proposed O-D2M comparing to other methods in terms of the accuracy of machine learning models trained by the selected data. Throughout the evaluation, we confirm that O-D2M obtains higher accuracy and lower computation cost while it can reduce the amount of data to be processed or transferred by up to 20 points.","2474-249X","978-1-6654-0418-1","10.1109/PERCOM50583.2021.9439127","","https://ieeexplore.ieee.org/stamp/stamp.jsp?arnumber=9439127","edge computing;data management","Pervasive computing;Performance evaluation;Time-frequency analysis;Machine learning algorithms;Machine learning;Feature extraction;Market research","","5","","36","IEEE","25 May 2021","","","IEEE","IEEE Conferences"
